objectid,originalfilename,filename,title,originaltitle,tributary,description,creator,callnumber,itemnumber,collectionname,repository,date,archivaldate,subject,damspace,damtime,submerged,location,latitude,longitude,sourcelink,format,type,language,display_template,object_location,image_small,image_thumb
sediment198,https://cdm16748.contentdm.oclc.org/digital/api/singleitem/image/cpa/16333/default.jpg,sediment198.jpg,Betatakin Ruin,"Navajo National Monument. Betatakin, Keet Seel, Inscription House, Scaffold House Ruins and Tsegi Canyon. Betatakin Ruin- (end of Ruin) (little bit of sky). [Caption by Josef Muench]",,,"Muench, Josef",NAU.PH.2003.11.14.B2673,39179,"Muench, Josef"," Special Collections and Archives, Cline Library, Northern Arizona University.",1960,1950-1970,sediment; humans; dwellings,,,,Glen Canyon; Betatakin,,,https://cdm16748.contentdm.oclc.org/digital/collection/cpa/id/16333/rec/29,image/jpeg,Image;StillImage,eng,image,https://cdil.lib.uidaho.edu/sedimentation/objects/sediment198.jpg,https://cdil.lib.uidaho.edu/sedimentation/objects/small/sediment198_sm.jpg,https://cdil.lib.uidaho.edu/sedimentation/objects/thumbs/sediment198_th.jpg
sediment199,https://cdm16748.contentdm.oclc.org/digital/api/singleitem/image/cpa/11040/default.jpg,sediment199.jpg,Hole-in-the-Rock blasted notch,"Historic Hole-in-the-Rock in Glen Canyon of the Colorado River, Utah. The narrow notch, showing signs of blasting that in 1880 was necessary to enable 250 Mormon Pioneers, their wagons and stock to descend 1000 feet to the river (tiny triangle in center) and to move on to settle in the area of Bluff. Part of the canyon is under waters of Lake Powell. [Caption given by Josef Muench]",,,"Muench, Josef",NAU.PH.2003.11.1.1.B-2715,15263,"Muench, Josef"," Special Collections and Archives, Cline Library, Northern Arizona University.",1952,1949-1956,sediment; humans; Mormons; Hole-in-the-rock; trails; ,,,,Glen Canyon; Hole-in-the-rock,37.2634192,-110.8734993,https://cdm16748.contentdm.oclc.org/digital/collection/cpa/id/11040/rec/41,image/jpeg,Image;StillImage,eng,image,https://cdil.lib.uidaho.edu/sedimentation/objects/sediment199.jpg,https://cdil.lib.uidaho.edu/sedimentation/objects/small/sediment199_sm.jpg,https://cdil.lib.uidaho.edu/sedimentation/objects/thumbs/sediment199_th.jpg
sediment200,https://cdm16748.contentdm.oclc.org/digital/api/singleitem/image/cpa/12936/default.jpg,sediment200.jpg,Colorado River,Flight to Blanding from Flagstaff.,,,"Nichols, Tad",NAU.PH.99.3.1.68.51,47138,"Nichols, Tad"," Special Collections and Archives, Cline Library, Northern Arizona University.",1957,1950-1965,sediment; land; river; water,,,,,,,https://cdm16748.contentdm.oclc.org/digital/collection/cpa/id/12936/rec/1580,image/jpeg,Image;StillImage,eng,image,https://cdil.lib.uidaho.edu/sedimentation/objects/sediment200.jpg,https://cdil.lib.uidaho.edu/sedimentation/objects/small/sediment200_sm.jpg,https://cdil.lib.uidaho.edu/sedimentation/objects/thumbs/sediment200_th.jpg
sediment201,,sediment201.jpg,Teton Dam pipes,,/humans/#remains-of-the-future,,"Green, Hannah",,,,,2025-12-17,2025-12-17,dam; infrastructure; humans,,,,Teton Dam,43.90988435,-111.5388776,,image/jpeg,Image;StillImage,eng,image,https://cdil.lib.uidaho.edu/sedimentation/objects/sediment201.jpg,https://cdil.lib.uidaho.edu/sedimentation/objects/small/sediment201_sm.jpg,https://cdil.lib.uidaho.edu/sedimentation/objects/thumbs/sediment201_th.jpg
sediment202,,sediment202.jpg,Teton Dam ruins,,/humans/#remains-of-the-future,,"Green, Hannah",,,,,2025-12-17,2025-12-17,dam; infrastructure; humans,,,,Teton Dam,43.90988435,-111.5388776,,image/jpeg,Image;StillImage,eng,image,https://cdil.lib.uidaho.edu/sedimentation/objects/sediment202.jpg,https://cdil.lib.uidaho.edu/sedimentation/objects/small/sediment202_sm.jpg,https://cdil.lib.uidaho.edu/sedimentation/objects/thumbs/sediment202_th.jpg
sediment203,,sediment203.jpg,Ruined abutment of the Teton Dam,,/humans/#remains-of-the-future,,"Green, Hannah",,,,,2025-12-17,2025-12-17,dam; infrastructure; humans,,,,Teton Dam,43.90988435,-111.5388776,,image/jpeg,Image;StillImage,eng,image,https://cdil.lib.uidaho.edu/sedimentation/objects/sediment203.jpg,https://cdil.lib.uidaho.edu/sedimentation/objects/small/sediment203_sm.jpg,https://cdil.lib.uidaho.edu/sedimentation/objects/thumbs/sediment203_th.jpg
sediment204,,sediment204.jpg,Antelope Canyon,,,,"Green, Hannah",,,,,2025-12-20,2025-12-20,sediment; land,,,,Antelope Canyon,36.86383927,-111.3827672,,image/jpeg,Image;StillImage,eng,image,https://cdil.lib.uidaho.edu/sedimentation/objects/sediment204.jpg,https://cdil.lib.uidaho.edu/sedimentation/objects/small/sediment204_sm.jpg,https://cdil.lib.uidaho.edu/sedimentation/objects/thumbs/sediment204_th.jpg
sediment205,,sediment205.jpg,Tourist boat ride through Wahweap Bay,,,,"Green, Hannah",,,,,2025-12-19,2025-12-19,humans; tourism; Lake Powell,Above dam,Post-dam,,Wahweap Bay; Glen Canyon; Lake Powell,36.971731,-111.481861,,image/jpeg,Image;StillImage,eng,image,https://cdil.lib.uidaho.edu/sedimentation/objects/sediment205.jpg,https://cdil.lib.uidaho.edu/sedimentation/objects/small/sediment205_sm.jpg,https://cdil.lib.uidaho.edu/sedimentation/objects/thumbs/sediment205_th.jpg
sediment206,,sediment206.jpg,Glen Canyon Dam in December 2025,,,,"Green, Hannah",,,,,2025-12-19,2025-12-19,dam; infrastructure; humans; Lake Powell,Above dam,Post-dam,Reemerged,Glen Canyon Dam; Glen Canyon; Lake Powell,36.94589467,-111.4883465,,image/jpeg,Image;StillImage,eng,image,https://cdil.lib.uidaho.edu/sedimentation/objects/sediment206.jpg,https://cdil.lib.uidaho.edu/sedimentation/objects/small/sediment206_sm.jpg,https://cdil.lib.uidaho.edu/sedimentation/objects/thumbs/sediment206_th.jpg
sediment207,,sediment207.jpg,Mineral-stained rock formations in Wahweap Bay,,,,"Green, Hannah",,,,,2025-12-19,2025-12-19,land; water; ,Above dam,Post-dam,Reemerged,Wahweap Bay; Glen Canyon; Lake Powell,36.95528404,-111.4881586,,image/jpeg,Image;StillImage,eng,image,https://cdil.lib.uidaho.edu/sedimentation/objects/sediment207.jpg,https://cdil.lib.uidaho.edu/sedimentation/objects/small/sediment207_sm.jpg,https://cdil.lib.uidaho.edu/sedimentation/objects/thumbs/sediment207_th.jpg
sediment208,,sediment208.jpg,Houseboat towed from an emptying Wahweap Marina,,,,"Green, Hannah",,,,,2025-12-19,2025-12-19,humans; tourism; Lake Powell,Above dam,Post-dam,Reemerged,Wahweap Bay; Wahweap Marina; Glen Canyon; Lake Powell,36.9932835,-111.4813662,,image/jpeg,Image;StillImage,eng,image,https://cdil.lib.uidaho.edu/sedimentation/objects/sediment208.jpg,https://cdil.lib.uidaho.edu/sedimentation/objects/small/sediment208_sm.jpg,https://cdil.lib.uidaho.edu/sedimentation/objects/thumbs/sediment208_th.jpg
sediment209,,sediment209.jpg,Sandstone laminations,,,,"Green, Hannah",,,,,2025-12-19,2025-12-19,land; atmosphere; wind,Above dam,Post-dam,,Glen Canyon,36.94676019,-111.4834229,,image/jpeg,Image;StillImage,eng,image,https://cdil.lib.uidaho.edu/sedimentation/objects/sediment209.jpg,https://cdil.lib.uidaho.edu/sedimentation/objects/small/sediment209_sm.jpg,https://cdil.lib.uidaho.edu/sedimentation/objects/thumbs/sediment209_th.jpg
sediment210,,sediment210.jpg,Mineral deposits flaking off after Lake Powell recedes,,/humans/#proliferations,,"Green, Hannah",,,,,2025-12-19,2025-12-19,land; Lake Powell; water,Above dam,Post-dam,Reemerged,Glen Canyon; Lake Powell,36.94857359,-111.4862405,,image/jpeg,Image;StillImage,eng,image,https://cdil.lib.uidaho.edu/sedimentation/objects/sediment210.jpg,https://cdil.lib.uidaho.edu/sedimentation/objects/small/sediment210_sm.jpg,https://cdil.lib.uidaho.edu/sedimentation/objects/thumbs/sediment210_th.jpg
sediment211,,sediment211.jpg,Sheep petroglyphs at Petroglyph Beach,,,,"Green, Hannah",,,,,2025-12-20,2025-12-20,humans; sheep; petroglyphs; biota,Below dam,Post-dam,,Glen Canyon; Petroglyph Beach,36.88729901,-111.527958,,image/jpeg,Image;StillImage,eng,image,https://cdil.lib.uidaho.edu/sedimentation/objects/sediment211.jpg,https://cdil.lib.uidaho.edu/sedimentation/objects/small/sediment211_sm.jpg,https://cdil.lib.uidaho.edu/sedimentation/objects/thumbs/sediment211_th.jpg
sediment212,,sediment212.jpg,Sandstone reflected in water,,,,"Green, Hannah",,,,,2025-12-20,2025-12-20,land; water,Below dam,Post-dam,,Glen Canyon,36.86485009,-111.5621148,,image/jpeg,Image;StillImage,eng,image,https://cdil.lib.uidaho.edu/sedimentation/objects/sediment212.jpg,https://cdil.lib.uidaho.edu/sedimentation/objects/small/sediment212_sm.jpg,https://cdil.lib.uidaho.edu/sedimentation/objects/thumbs/sediment212_th.jpg
sediment213,,sediment213.jpg,Deep sand at Lone Rock,,,,"Green, Hannah",,,,,2025-12-21,2025-12-21,land; water; Lake Powell,Above dam,Post-dam,Reemerged,Glen Canyon; Lake Powell; Lone Rock; Wahweap Bay,37.0216714,-111.540088,,image/jpeg,Image;StillImage,eng,image,https://cdil.lib.uidaho.edu/sedimentation/objects/sediment213.jpg,https://cdil.lib.uidaho.edu/sedimentation/objects/small/sediment213_sm.jpg,https://cdil.lib.uidaho.edu/sedimentation/objects/thumbs/sediment213_th.jpg
sediment214,,sediment214.jpg,Remnants of Lake Powell at Lone Rock,,,,"Green, Hannah",,,,,2025-12-21,2025-12-21,land; water; Lake Powell,Above dam,Post-dam,Reemerged,Glen Canyon; Lake Powell; Lone Rock; Wahweap Bay,37.02479521,-111.5375261,,image/jpeg,Image;StillImage,eng,image,https://cdil.lib.uidaho.edu/sedimentation/objects/sediment214.jpg,https://cdil.lib.uidaho.edu/sedimentation/objects/small/sediment214_sm.jpg,https://cdil.lib.uidaho.edu/sedimentation/objects/thumbs/sediment214_th.jpg
sediment215,,sediment215.jpg,Mucky remains of Lake Powell at Lone Rock,,,,"Green, Hannah",,,,,2025-12-21,2025-12-21,land; water; Lake Powell,Above dam,Post-dam,Reemerged,Glen Canyon; Lake Powell; Lone Rock; Wahweap Bay,37.02319613,-111.5367343,,image/jpeg,Image;StillImage,eng,image,https://cdil.lib.uidaho.edu/sedimentation/objects/sediment215.jpg,https://cdil.lib.uidaho.edu/sedimentation/objects/small/sediment215_sm.jpg,https://cdil.lib.uidaho.edu/sedimentation/objects/thumbs/sediment215_th.jpg
sediment216,,sediment216.jpg,"Lone Rock, bleached white with mineral deposits",,,,"Green, Hannah",,,,,2025-12-21,2025-12-21,land; water; Lake Powell,Above dam,Post-dam,Reemerged,Glen Canyon; Lake Powell; Lone Rock; Wahweap Bay,37.02794729,-111.5358744,,image/jpeg,Image;StillImage,eng,image,https://cdil.lib.uidaho.edu/sedimentation/objects/sediment216.jpg,https://cdil.lib.uidaho.edu/sedimentation/objects/small/sediment216_sm.jpg,https://cdil.lib.uidaho.edu/sedimentation/objects/thumbs/sediment216_th.jpg
sediment217,,sediment217.jpg,"Pawprints and plants growing in mudcracks, Lone Rock Beach",,/humans/#proliferations,,"Green, Hannah",,,,,2025-12-21,2025-12-21,land; water; Lake Powell; biota; plants; animals,Above dam,Post-dam,Reemerged,Glen Canyon; Lake Powell; Lone Rock; Wahweap Bay,37.02541193,-111.5379773,,image/jpeg,Image;StillImage,eng,image,https://cdil.lib.uidaho.edu/sedimentation/objects/sediment217.jpg,https://cdil.lib.uidaho.edu/sedimentation/objects/small/sediment217_sm.jpg,https://cdil.lib.uidaho.edu/sedimentation/objects/thumbs/sediment217_th.jpg
sediment218,,sediment218.jpg,Bacterial blooms and muck at Lone Rock,,/humans/#proliferations,,"Green, Hannah",,,,,2025-12-21,2025-12-21,water; biota; microbes,Above dam,Post-dam,,Glen Canyon; Lake Powell; Lone Rock; Wahweap Bay,37.02681667,-111.5397797,,image/jpeg,Image;StillImage,eng,image,https://cdil.lib.uidaho.edu/sedimentation/objects/sediment218.jpg,https://cdil.lib.uidaho.edu/sedimentation/objects/small/sediment218_sm.jpg,https://cdil.lib.uidaho.edu/sedimentation/objects/thumbs/sediment218_th.jpg
sediment219,,sediment219.jpg,Lake Powell disappearing at Lone Rock Beach,,,,"Green, Hannah",,,,,2025-12-19,2025-12-19,land; water; Lake Powell,Above dam,Post-dam,Reemerged,Glen Canyon; Lake Powell; Lone Rock; Wahweap Bay,37.02253384,-111.5353165,,image/jpeg,Image;StillImage,eng,image,https://cdil.lib.uidaho.edu/sedimentation/objects/sediment219.jpg,https://cdil.lib.uidaho.edu/sedimentation/objects/small/sediment219_sm.jpg,https://cdil.lib.uidaho.edu/sedimentation/objects/thumbs/sediment219_th.jpg
sediment220,,sediment220.jpg,Tourists examining the sediment beds at Lone Rock,,,,"Green, Hannah",,,,,2025-12-19,2025-12-19,land; water; Lake Powell; humans; tourism,Above dam,Post-dam,Reemerged,Glen Canyon; Lake Powell; Lone Rock; Wahweap Bay,37.02225973,-111.5384923,,image/jpeg,Image;StillImage,eng,image,https://cdil.lib.uidaho.edu/sedimentation/objects/sediment220.jpg,https://cdil.lib.uidaho.edu/sedimentation/objects/small/sediment220_sm.jpg,https://cdil.lib.uidaho.edu/sedimentation/objects/thumbs/sediment220_th.jpg
sediment221,,sediment221.jpg,Plants regrowing in a re-emerged rock hollow,,,,"Green, Hannah",,,,,2025-12-22,2025-12-22,land; water; biota; plants; Lake Powell,Above dam,Post-dam,Reemerged,Glen Canyon; Lake Powell,36.96422418,-111.4794397,,image/jpeg,Image;StillImage,eng,image,https://cdil.lib.uidaho.edu/sedimentation/objects/sediment221.jpg,https://cdil.lib.uidaho.edu/sedimentation/objects/small/sediment221_sm.jpg,https://cdil.lib.uidaho.edu/sedimentation/objects/thumbs/sediment221_th.jpg
sediment222,,sediment222.jpg,Bleached rock formations at Lake Powell,,,,"Green, Hannah",,,,,2025-12-22,2025-12-22,land; water; Lake Powell,Above dam,Post-dam,Reemerged,Glen Canyon; Lake Powell; Glen Canyon Dam,36.96422418,-111.4794397,,image/jpeg,Image;StillImage,eng,image,https://cdil.lib.uidaho.edu/sedimentation/objects/sediment222.jpg,https://cdil.lib.uidaho.edu/sedimentation/objects/small/sediment222_sm.jpg,https://cdil.lib.uidaho.edu/sedimentation/objects/thumbs/sediment222_th.jpg
sediment223,,sediment223.jpg,Glen Canyon Dam,,,,"Green, Hannah",,,,,2025-12-19,2025-12-19,dam; humans; infrastructure; Lake Powell,Above dam,Post-dam,,Glen Canyon; Lake Powell; Glen Canyon Dam,36.93776744,-111.4845803,,image/jpeg,Image;StillImage,eng,image,https://cdil.lib.uidaho.edu/sedimentation/objects/sediment223.jpg,https://cdil.lib.uidaho.edu/sedimentation/objects/small/sediment223_sm.jpg,https://cdil.lib.uidaho.edu/sedimentation/objects/thumbs/sediment223_th.jpg
sediment224,,sediment224.jpg,Twin Warriors,,,,"Green, Hannah",,,,,2025-12-19,2025-12-19,land; atmosphere; wind,,Post-dam,,Twin Warriors,37.28805584,-109.5482511,,image/jpeg,Image;StillImage,eng,image,https://cdil.lib.uidaho.edu/sedimentation/objects/sediment224.jpg,https://cdil.lib.uidaho.edu/sedimentation/objects/small/sediment224_sm.jpg,https://cdil.lib.uidaho.edu/sedimentation/objects/thumbs/sediment224_th.jpg
sediment225,,sediment225.jpg,Mineral crusts flaking off after Lake Powell recedes,,,,"Green, Hannah",,,,,2025-12-19,2025-12-19,land; water; Lake Powell,Above dam,Post-dam,Reemerged,Glen Canyon; Lake Powell; Glen Canyon Dam,36.9957109,-111.4858165,,image/jpeg,Image;StillImage,eng,image,https://cdil.lib.uidaho.edu/sedimentation/objects/sediment225.jpg,https://cdil.lib.uidaho.edu/sedimentation/objects/small/sediment225_sm.jpg,https://cdil.lib.uidaho.edu/sedimentation/objects/thumbs/sediment225_th.jpg
sediment226,,sediment226.jpg,Lake Powell Resort standing high above Lake Powell's dry bed,,,,"Green, Hannah",,,,,2025-12-19,2025-12-19,land; water; humans; Lake Powell; infrastructure; humans; tourism; sediment; biota; plants,Above dam,Post-dam,Reemerged,Glen Canyon; Lake Powell; Wahweap Bay; Lake Powell Resort,36.9957109,-111.4858165,,image/jpeg,Image;StillImage,eng,image,https://cdil.lib.uidaho.edu/sedimentation/objects/sediment226.jpg,https://cdil.lib.uidaho.edu/sedimentation/objects/small/sediment226_sm.jpg,https://cdil.lib.uidaho.edu/sedimentation/objects/thumbs/sediment226_th.jpg
sediment227,,sediment227.jpg,Sediment beds at the edge of a shrinking Lake Powell,,,,"Green, Hannah",,,,,2025-12-19,2025-12-19,land; water; humans; Lake Powell; humans; sediment; biota; plants,Above dam,Post-dam,Reemerged,Glen Canyon; Lake Powell; Wahweap Bay; Lake Powell Resort,36.9957109,-111.4858165,,image/jpeg,Image;StillImage,eng,image,https://cdil.lib.uidaho.edu/sedimentation/objects/sediment227.jpg,https://cdil.lib.uidaho.edu/sedimentation/objects/small/sediment227_sm.jpg,https://cdil.lib.uidaho.edu/sedimentation/objects/thumbs/sediment227_th.jpg
sediment228,,sediment228.jpg,Pathway to boat dock empties into Lake Powell's dry bed,,,,"Green, Hannah",,,,,2025-12-19,2025-12-19,land; water; humans; Lake Powell; infrastructure; humans; tourism; sediment; biota; plants,Above dam,Post-dam,Reemerged,Glen Canyon; Lake Powell; Wahweap Bay; Lake Powell Resort,36.9957109,-111.4858165,,image/jpeg,Image;StillImage,eng,image,https://cdil.lib.uidaho.edu/sedimentation/objects/sediment228.jpg,https://cdil.lib.uidaho.edu/sedimentation/objects/small/sediment228_sm.jpg,https://cdil.lib.uidaho.edu/sedimentation/objects/thumbs/sediment228_th.jpg
sediment229,,sediment229.jpg,A shrinking cove below Lake Powell Resort,,,,"Green, Hannah",,,,,2025-12-19,2025-12-19,land; water; humans; Lake Powell; infrastructure; humans; tourism; sediment; biota; plants,Above dam,Post-dam,Reemerged,Glen Canyon; Lake Powell; Wahweap Bay; Lake Powell Resort,36.9957109,-111.4858165,,image/jpeg,Image;StillImage,eng,image,https://cdil.lib.uidaho.edu/sedimentation/objects/sediment229.jpg,https://cdil.lib.uidaho.edu/sedimentation/objects/small/sediment229_sm.jpg,https://cdil.lib.uidaho.edu/sedimentation/objects/thumbs/sediment229_th.jpg
sediment230,,sediment230.jpg,American Coots gather in a cove at Lake Powell,,,,"Green, Hannah",,,,,2025-12-19,2025-12-19,land; water; humans; Lake Powell; humans; sediment; biota; animals; birds,Above dam,Post-dam,Reemerged,Glen Canyon; Lake Powell; Wahweap Bay; Lake Powell Resort,36.9957109,-111.4858165,,image/jpeg,Image;StillImage,eng,image,https://cdil.lib.uidaho.edu/sedimentation/objects/sediment230.jpg,https://cdil.lib.uidaho.edu/sedimentation/objects/small/sediment230_sm.jpg,https://cdil.lib.uidaho.edu/sedimentation/objects/thumbs/sediment230_th.jpg
sediment231,,sediment231.jpg,Anchor chain for boats in Lake Powell's dry bed,,,,"Green, Hannah",,,,,2025-12-19,2025-12-19,land; water; humans; Lake Powell; infrastructure; tourism,Above dam,Post-dam,Reemerged,Glen Canyon; Lake Powell; Wahweap Bay; Lake Powell Resort,36.9957109,-111.4858165,,image/jpeg,Image;StillImage,eng,image,https://cdil.lib.uidaho.edu/sedimentation/objects/sediment231.jpg,https://cdil.lib.uidaho.edu/sedimentation/objects/small/sediment231_sm.jpg,https://cdil.lib.uidaho.edu/sedimentation/objects/thumbs/sediment231_th.jpg
sediment232,,sediment232.jpg,Lake Powell Resort at full pool,,,,,,,,,,,humans; Lake Powell; infrastructure; tourism,,,,Glen Canyon; Lake Powell; Wahweap Bay; Lake Powell Resort,36.9957109,-111.4858165,,image/jpeg,Image;StillImage,eng,image,https://cdil.lib.uidaho.edu/sedimentation/objects/sediment232.jpg,https://cdil.lib.uidaho.edu/sedimentation/objects/small/sediment232_sm.jpg,https://cdil.lib.uidaho.edu/sedimentation/objects/thumbs/sediment232_th.jpg
sediment233,,sediment233.jpg,Bleached cliffs at Lake Powell,,,,"Green, Hannah",,,,,2025-12-19,2025-12-19,land; water; Lake Powell,Above dam,Post-dam,Reemerged,Glen Canyon; Lake Powell; Wahweap Bay,36.97695682,-111.4891367,,image/jpeg,Image;StillImage,eng,image,https://cdil.lib.uidaho.edu/sedimentation/objects/sediment233.jpg,https://cdil.lib.uidaho.edu/sedimentation/objects/small/sediment233_sm.jpg,https://cdil.lib.uidaho.edu/sedimentation/objects/thumbs/sediment233_th.jpg
sediment234,,sediment234.jpg,Recycling container at Lake Powell Resort calls for water conservation,,,,"Green, Hannah",,,,,2025-12-19,2025-12-19,humans; tourism; water,Above dam,Post-dam,,Glen Canyon; Lake Powell; Wahweap Bay; Lake Powell Resort,36.9957109,-111.4858165,,image/jpeg,Image;StillImage,eng,image,https://cdil.lib.uidaho.edu/sedimentation/objects/sediment234.jpg,https://cdil.lib.uidaho.edu/sedimentation/objects/small/sediment234_sm.jpg,https://cdil.lib.uidaho.edu/sedimentation/objects/thumbs/sediment234_th.jpg
sediment235,,sediment235.jpg,Bleached rocks reemerging out of Lake Powell,,,,"Green, Hannah",,,,,2025-12-19,2025-12-19,land; water; Lake Powell,Above dam,Post-dam,Reemerged,Glen Canyon; Lake Powell; Wahweap Bay; Lake Powell Resort,36.97725437,-111.4856357,,image/jpeg,Image;StillImage,eng,image,https://cdil.lib.uidaho.edu/sedimentation/objects/sediment235.jpg,https://cdil.lib.uidaho.edu/sedimentation/objects/small/sediment235_sm.jpg,https://cdil.lib.uidaho.edu/sedimentation/objects/thumbs/sediment235_th.jpg
sediment236,,sediment236.jpg,Previously submerged rock formations with remnant mineral scaling,,,,"Green, Hannah",,,,,2025-12-19,2025-12-19,land; water; Lake Powell; atmosphere; wind,Above dam,Post-dam,Reemerged,Glen Canyon; Lake Powell,36.94883849,-111.484592,,image/jpeg,Image;StillImage,eng,image,https://cdil.lib.uidaho.edu/sedimentation/objects/sediment236.jpg,https://cdil.lib.uidaho.edu/sedimentation/objects/small/sediment236_sm.jpg,https://cdil.lib.uidaho.edu/sedimentation/objects/thumbs/sediment236_th.jpg
sediment237,,sediment237.jpg,Reemerged rock formations with mineral crust,,,,"Green, Hannah",,,,,2025-12-20,2025-12-20,land; water; Lake Powell; atmosphere; wind,Above dam,Post-dam,,Glen Canyon; Lake Powell,36.94883849,-111.484592,,image/jpeg,Image;StillImage,eng,image,https://cdil.lib.uidaho.edu/sedimentation/objects/sediment237.jpg,https://cdil.lib.uidaho.edu/sedimentation/objects/small/sediment237_sm.jpg,https://cdil.lib.uidaho.edu/sedimentation/objects/thumbs/sediment237_th.jpg
sediment238,,sediment238.mp4,Boating up a slow-moving Colorado River from Lee's Ferry,,,,"Green, Hannah",,,,,2025-12-20,2025-12-20,land; water; river,Below dam,Post-dam,,Glen Canyon,36.86281603,-111.5606817,,video/mp4,Video;MovingImage,eng,video,https://cdil.lib.uidaho.edu/sedimentation/objects/sediment238.mp4,,https://cdil.lib.uidaho.edu/sedimentation/objects/thumbs/sediment238_th.jpg
sediment239,,sediment239.jpg,Petroglyphs at Petroglyph Beach,,,,"Green, Hannah",,,,,2025-12-20,2025-12-20,humans; petroglyphs,Below dam,Post-dam,,Glen Canyon; Petroglyph Beach,36.88729901,-111.527958,,image/jpeg,Image;StillImage,eng,image,https://cdil.lib.uidaho.edu/sedimentation/objects/sediment239.jpg,https://cdil.lib.uidaho.edu/sedimentation/objects/small/sediment239_sm.jpg,https://cdil.lib.uidaho.edu/sedimentation/objects/thumbs/sediment239_th.jpg
sediment240,,sediment240.jpg,"The Colorado River, below Glen Canyon Dam",,,,"Green, Hannah",,,,,2025-12-20,2025-12-20,land; water; river,Below dam,Post-dam,,Glen Canyon,36.885034,-111.5266843,,image/jpeg,Image;StillImage,eng,image,https://cdil.lib.uidaho.edu/sedimentation/objects/sediment240.jpg,https://cdil.lib.uidaho.edu/sedimentation/objects/small/sediment240_sm.jpg,https://cdil.lib.uidaho.edu/sedimentation/objects/thumbs/sediment240_th.jpg
sediment241,,sediment241.jpg,"A clear blue Colorado River, below Glen Canyon Dam",,,,"Green, Hannah",,,,,2025-12-20,2025-12-20,land; water; river,Below dam,Post-dam,,Glen Canyon,36.885034,-111.5266843,,image/jpeg,Image;StillImage,eng,image,https://cdil.lib.uidaho.edu/sedimentation/objects/sediment241.jpg,https://cdil.lib.uidaho.edu/sedimentation/objects/small/sediment241_sm.jpg,https://cdil.lib.uidaho.edu/sedimentation/objects/thumbs/sediment241_th.jpg
sediment242,,sediment242.jpg,"Paria River Riffle, the first rapids after Glen Canyon Dam",,,,"Green, Hannah",,,,,2025-12-20,2025-12-20,land; water; river,Below dam,Post-dam,,Glen Canyon; Lee's Ferry,36.85349455,-111.607339,,image/jpeg,Image;StillImage,eng,image,https://cdil.lib.uidaho.edu/sedimentation/objects/sediment242.jpg,https://cdil.lib.uidaho.edu/sedimentation/objects/small/sediment242_sm.jpg,https://cdil.lib.uidaho.edu/sedimentation/objects/thumbs/sediment242_th.jpg
sediment243,,sediment243.jpg,The Colorado River from Navajo Bridge,,,,"Green, Hannah",,,,,2025-12-20,2025-12-20,land; water; river,Below dam,Post-dam,,Glen Canyon; Navajo Bridge,36.81764814,-111.6312526,,image/jpeg,Image;StillImage,eng,image,https://cdil.lib.uidaho.edu/sedimentation/objects/sediment243.jpg,https://cdil.lib.uidaho.edu/sedimentation/objects/small/sediment243_sm.jpg,https://cdil.lib.uidaho.edu/sedimentation/objects/thumbs/sediment243_th.jpg
sediment244,,sediment244.jpg,Houseboats in a parking lot near Wahweap Marina,,,,"Green, Hannah",,,,,2025-12-21,2025-12-21,humans; tourism,Above dam,Post-dam,,Glen Canyon; Lake Powell; Wahweap Bay; Wahweap Marina,37.00344539,-111.5001563,,image/jpeg,Image;StillImage,eng,image,https://cdil.lib.uidaho.edu/sedimentation/objects/sediment244.jpg,https://cdil.lib.uidaho.edu/sedimentation/objects/small/sediment244_sm.jpg,https://cdil.lib.uidaho.edu/sedimentation/objects/thumbs/sediment244_th.jpg
sediment245,,sediment245.jpg,"Vehicle tracks across Lake Powell's dry bed, heading to Lone Rock",,,,"Green, Hannah",,,,,2025-12-21,2025-12-21,land; water; Lake Powell; sediment,Above dam,Post-dam,Reemerged,Glen Canyon; Lone Rock; Wahweap Bay,37.02815031,-111.5332225,,image/jpeg,Image;StillImage,eng,image,https://cdil.lib.uidaho.edu/sedimentation/objects/sediment245.jpg,https://cdil.lib.uidaho.edu/sedimentation/objects/small/sediment245_sm.jpg,https://cdil.lib.uidaho.edu/sedimentation/objects/thumbs/sediment245_th.jpg
sediment246,,sediment246.jpg,Patches of calcium crust on reemerged rock formations,,,,"Green, Hannah",,,,,2025-12-19,2025-12-19,land; water; Lake Powell; atmosphere; wind,Above dam,Post-dam,Reemerged,Glen Canyon; Lake Powell,36.94883849,-111.484592,,image/jpeg,Image;StillImage,eng,image,https://cdil.lib.uidaho.edu/sedimentation/objects/sediment246.jpg,https://cdil.lib.uidaho.edu/sedimentation/objects/small/sediment246_sm.jpg,https://cdil.lib.uidaho.edu/sedimentation/objects/thumbs/sediment246_th.jpg
