objectid,originalfilename,filename,title,originaltitle,tributary,description,creator,callnumber,itemnumber,collectionname,repository,date,archivaldate,subject,damspace,damtime,submerged,location,latitude,longitude,sourcelink,format,type,language,display_template,object_location,image_small,image_thumb
sediment44,https://cdm16748.contentdm.oclc.org/digital/api/singleitem/image/cpa/11540/default.jpg,sediment44.jpg,Dwelling in Wishbone Canyon,[Ruin in Wishbone Canyon; this image appears in Tad's Glen Canyon book on page 82.],,,"Nichols, Tad",NAU.PH.99.3.1.71.4,27032,"Nichols, Tad"," Special Collections and Archives, Cline Library, Northern Arizona University.",1957,1950-1965,sediment; humans; dwellings,,,,Glen Canyon; Wishbone Canyon,37.11272198,-110.9427398,https://cdm16748.contentdm.oclc.org/digital/collection/cpa/id/11540/rec/440,image/jpeg,Image;StillImage,eng,image,https://cdil.lib.uidaho.edu/sedimentation/objects/sediment44.jpg,https://cdil.lib.uidaho.edu/sedimentation/objects/small/sediment44_sm.jpg,https://cdil.lib.uidaho.edu/sedimentation/objects/thumbs/sediment44_th.jpg
sediment45,https://cdm16748.contentdm.oclc.org/digital/api/singleitem/image/cpa/9427/default.jpg,sediment45.jpg,Petroglyphs at Smith Fork,Petroglyphs at Smith Fork [constructed title].,,,"Nichols, Tad",NAU.PH.99.3.1.8.109,29755,"Nichols, Tad"," Special Collections and Archives, Cline Library, Northern Arizona University.",1955,1955,sediment; humans; petroglyphs; art; atmosphere; wind; tracks,,,,Glen Canyon; Smith Fork,37.59933999,-110.6395824,https://cdm16748.contentdm.oclc.org/digital/collection/cpa/id/9427/rec/458,image/jpeg,Image;StillImage,eng,image,https://cdil.lib.uidaho.edu/sedimentation/objects/sediment45.jpg,https://cdil.lib.uidaho.edu/sedimentation/objects/small/sediment45_sm.jpg,https://cdil.lib.uidaho.edu/sedimentation/objects/thumbs/sediment45_th.jpg
sediment46,https://cdm16748.contentdm.oclc.org/digital/api/singleitem/image/cpa/11732/default.jpg,sediment46.jpg,Curved ridges on cliff wall,[Geological formation (curved ridges) on cliff wall - Lake Powell area.],,,"Nichols, Tad",NAU.PH.99.3.1.43.2,24654,"Nichols, Tad"," Special Collections and Archives, Cline Library, Northern Arizona University.",1968,1968,sediment; land; atmosphere; wind,,Post-dam,,Glen Canyon,,,https://cdm16748.contentdm.oclc.org/digital/collection/cpa/id/11732/rec/461,image/jpeg,Image;StillImage,eng,image,https://cdil.lib.uidaho.edu/sedimentation/objects/sediment46.jpg,https://cdil.lib.uidaho.edu/sedimentation/objects/small/sediment46_sm.jpg,https://cdil.lib.uidaho.edu/sedimentation/objects/thumbs/sediment46_th.jpg
sediment47,https://cdm16748.contentdm.oclc.org/digital/api/singleitem/image/cpa/9431/default.jpg,sediment47.jpg,Balanced rock,[Balanced Rocks].,/atmosphere/#formations,,"Nichols, Tad",NAU.PH.99.3.1.11.99,20519,"Nichols, Tad"," Special Collections and Archives, Cline Library, Northern Arizona University.",1957,1957,sediment; land; atmosphere; wind; wonder,,Pre-dam,,Glen Canyon,,,https://cdm16748.contentdm.oclc.org/digital/collection/cpa/id/9431/rec/472,image/jpeg,Image;StillImage,eng,image,https://cdil.lib.uidaho.edu/sedimentation/objects/sediment47.jpg,https://cdil.lib.uidaho.edu/sedimentation/objects/small/sediment47_sm.jpg,https://cdil.lib.uidaho.edu/sedimentation/objects/thumbs/sediment47_th.jpg
sediment48,https://cdm16748.contentdm.oclc.org/digital/api/singleitem/image/cpa/17317/default.jpg,sediment48.jpg,Ancestral Puebloan loom holes,Anasazi loom holes.,,,"Nichols, Tad",NAU.PH.99.3.1.15.78,28473,"Nichols, Tad"," Special Collections and Archives, Cline Library, Northern Arizona University.",1958,1958,sediment; humans; loom holes; tracks,,Pre-dam,,,,,https://cdm16748.contentdm.oclc.org/digital/collection/cpa/id/17317/rec/791,image/jpeg,Image;StillImage,eng,image,https://cdil.lib.uidaho.edu/sedimentation/objects/sediment48.jpg,https://cdil.lib.uidaho.edu/sedimentation/objects/small/sediment48_sm.jpg,https://cdil.lib.uidaho.edu/sedimentation/objects/thumbs/sediment48_th.jpg
sediment49,https://cdm16748.contentdm.oclc.org/digital/api/singleitem/image/cpa/17318/default.jpg,sediment49.jpg,Ancestral Puebloan loom holes,Anasazi loom holes.,/humans/#inscriptions,,"Nichols, Tad",NAU.PH.99.3.1.15.79,28474,"Nichols, Tad"," Special Collections and Archives, Cline Library, Northern Arizona University.",1958,1958,sediment; humans; loom holes; tracks,,Pre-dam,,,,,https://cdm16748.contentdm.oclc.org/digital/collection/cpa/id/17318/rec/797,image/jpeg,Image;StillImage,eng,image,https://cdil.lib.uidaho.edu/sedimentation/objects/sediment49.jpg,https://cdil.lib.uidaho.edu/sedimentation/objects/small/sediment49_sm.jpg,https://cdil.lib.uidaho.edu/sedimentation/objects/thumbs/sediment49_th.jpg
sediment50,https://cdm16748.contentdm.oclc.org/digital/api/singleitem/image/cpa/23083/default.jpg,sediment50.jpg,Navajo Twins rock formation,"Navajo Twins - Bluff, Utah [rock formations].",,,"Nichols, Tad",NAU.PH.99.3.1.12.99,21745,"Nichols, Tad"," Special Collections and Archives, Cline Library, Northern Arizona University.",1957,1957,sediment; land; ,,Pre-dam,,Bluff; Navajo Twins,37.28794322,-109.5476355,https://cdm16748.contentdm.oclc.org/digital/collection/cpa/id/23083/rec/869,image/jpeg,Image;StillImage,eng,image,https://cdil.lib.uidaho.edu/sedimentation/objects/sediment50.jpg,https://cdil.lib.uidaho.edu/sedimentation/objects/small/sediment50_sm.jpg,https://cdil.lib.uidaho.edu/sedimentation/objects/thumbs/sediment50_th.jpg
sediment51,https://cdm16748.contentdm.oclc.org/digital/api/singleitem/image/cpa/11188/default.jpg,sediment51.jpg,Tracks in sandstone,Geology. Tracks in S.S. [sandstone] Tsegi-ot-Sosi. Aug. '53.,,,"Nichols, Tad",NAU.PH.99.3.7.5.21,64178,"Nichols, Tad"," Special Collections and Archives, Cline Library, Northern Arizona University.",1953,1953,sediment; biota; animals; tracks,,Pre-dam,,,,,https://cdm16748.contentdm.oclc.org/digital/collection/cpa/id/11188/rec/1058,image/jpeg,Image;StillImage,eng,image,https://cdil.lib.uidaho.edu/sedimentation/objects/sediment51.jpg,https://cdil.lib.uidaho.edu/sedimentation/objects/small/sediment51_sm.jpg,https://cdil.lib.uidaho.edu/sedimentation/objects/thumbs/sediment51_th.jpg
sediment52,https://cdm16748.contentdm.oclc.org/digital/api/singleitem/image/cpa/12148/default.jpg,sediment52.jpg,Lichen on a sandstone wall,[Lichen.],,,"Nichols, Tad",NAU.PH.99.3.1.62.40,24940,"Nichols, Tad"," Special Collections and Archives, Cline Library, Northern Arizona University.",1976,1976,sediment; microbes; lichen; biota,,Post-dam,,Glen Canyon,,,https://cdm16748.contentdm.oclc.org/digital/collection/cpa/id/12148/rec/1098,image/jpeg,Image;StillImage,eng,image,https://cdil.lib.uidaho.edu/sedimentation/objects/sediment52.jpg,https://cdil.lib.uidaho.edu/sedimentation/objects/small/sediment52_sm.jpg,https://cdil.lib.uidaho.edu/sedimentation/objects/thumbs/sediment52_th.jpg
sediment53,https://cdm16748.contentdm.oclc.org/digital/api/singleitem/image/cpa/11579/default.jpg,sediment53.jpg,Navajo sheep herder,Navajo sheep herder. [with herd of sheep].,,,"Nichols, Tad",NAU.PH.99.3.7.7.49,68670,"Nichols, Tad"," Special Collections and Archives, Cline Library, Northern Arizona University.",1948,1948,sediment; humans; sheep; animals; biota,,Pre-dam,,,,,https://cdm16748.contentdm.oclc.org/digital/collection/cpa/id/11579/rec/1,image/jpeg,Image;StillImage,eng,image,https://cdil.lib.uidaho.edu/sedimentation/objects/sediment53.jpg,https://cdil.lib.uidaho.edu/sedimentation/objects/small/sediment53_sm.jpg,https://cdil.lib.uidaho.edu/sedimentation/objects/thumbs/sediment53_th.jpg
sediment54,https://cdm16748.contentdm.oclc.org/digital/api/singleitem/image/cpa/16756/default.jpg,sediment54.jpg,Figure in Dungeon Canyon,[Figure in Dungeon Canyon.],/atmosphere/#images-of-a-lost-world,,"Nichols, Tad",NAU.PH.99.3.1.9.93,19941,"Nichols, Tad"," Special Collections and Archives, Cline Library, Northern Arizona University.",1956,1956,sediment; atmosphere; wonder; tourism,Above Dam,Pre-dam,,Glen Canyon; Dungeon Canyon,37.06972305,-111.1509796,https://cdm16748.contentdm.oclc.org/digital/collection/cpa/id/16756/rec/1100,image/jpeg,Image;StillImage,eng,image,https://cdil.lib.uidaho.edu/sedimentation/objects/sediment54.jpg,https://cdil.lib.uidaho.edu/sedimentation/objects/small/sediment54_sm.jpg,https://cdil.lib.uidaho.edu/sedimentation/objects/thumbs/sediment54_th.jpg
sediment55,https://cdm16748.contentdm.oclc.org/digital/api/singleitem/image/cpa/21336/default.jpg,sediment55.jpg,Date inscription in rock: 1933,[Date inscription in rock: 1933.],/atmosphere/#formations; /humans/#inscriptions,,"Nichols, Tad",NAU.PH.99.3.1.19.56,23002,"Nichols, Tad"," Special Collections and Archives, Cline Library, Northern Arizona University.",1960,1960,sediment; humans; exploration; tracks; ,,,,Glen Canyon,,,https://cdm16748.contentdm.oclc.org/digital/collection/cpa/id/21336/rec/606,image/jpeg,Image;StillImage,eng,image,https://cdil.lib.uidaho.edu/sedimentation/objects/sediment55.jpg,https://cdil.lib.uidaho.edu/sedimentation/objects/small/sediment55_sm.jpg,https://cdil.lib.uidaho.edu/sedimentation/objects/thumbs/sediment55_th.jpg
sediment56,https://cdm16748.contentdm.oclc.org/digital/api/singleitem/image/cpa/9440/default.jpg,sediment56.jpg,Ruins of mining machinery at Olympia Bar,Ruins of mining structure and machinery at Olympia Bar [constructed title] [This image appears in Tad's Glen Canyon book on page 24.].,,,"Nichols, Tad",NAU.PH.99.3.1.8.107,29750,"Nichols, Tad"," Special Collections and Archives, Cline Library, Northern Arizona University.",1955,1955,sediment; mining; infrastructure; humans,Above Dam,Pre-Dam,submerged,Glen Canyon; Olympia Bar,37.59503187,-110.6007059,https://cdm16748.contentdm.oclc.org/digital/collection/cpa/id/9440/rec/669,image/jpeg,Image;StillImage,eng,image,https://cdil.lib.uidaho.edu/sedimentation/objects/sediment56.jpg,https://cdil.lib.uidaho.edu/sedimentation/objects/small/sediment56_sm.jpg,https://cdil.lib.uidaho.edu/sedimentation/objects/thumbs/sediment56_th.jpg
sediment57,https://cdm16748.contentdm.oclc.org/digital/api/singleitem/image/cpa/22677/default.jpg,sediment57.jpg,Steps near Hole-in-the-Rock,"2 sets steps, 1 mile upstream from Hole-in-Rock.",,,"Nichols, Tad",NAU.PH.99.3.1.62.48,25886,"Nichols, Tad"," Special Collections and Archives, Cline Library, Northern Arizona University.",1976,1976,sediment; humans; Mormons,Above Dam,Post-Dam,,Glen Canyon; Hole-in-the-Rock,37.2634192,-110.8734993,https://cdm16748.contentdm.oclc.org/digital/collection/cpa/id/22677/rec/485,image/jpeg,Image;StillImage,eng,image,https://cdil.lib.uidaho.edu/sedimentation/objects/sediment57.jpg,https://cdil.lib.uidaho.edu/sedimentation/objects/small/sediment57_sm.jpg,https://cdil.lib.uidaho.edu/sedimentation/objects/thumbs/sediment57_th.jpg
sediment58,https://cdm16748.contentdm.oclc.org/digital/api/singleitem/image/cpa/11061/default.jpg,sediment58.jpg,Cutting steps up Pick Axe Canyon,[Mike and Frank cutting steps up Pick Axe Canyon (False Entrance Canyon).],,,"Nichols, Tad",NAU.PH.99.3.1.19.10,22885,"Nichols, Tad"," Special Collections and Archives, Cline Library, Northern Arizona University.",1960,1960,sediment; exploration; humans,Above Dam,Pre-Dam,submerged,Glen Canyon; False Entrance Canyon; Pick Ax Canyon,37.0957728,-111.0627873,https://cdm16748.contentdm.oclc.org/digital/collection/cpa/id/11061/rec/54,image/jpeg,Image;StillImage,eng,image,https://cdil.lib.uidaho.edu/sedimentation/objects/sediment58.jpg,https://cdil.lib.uidaho.edu/sedimentation/objects/small/sediment58_sm.jpg,https://cdil.lib.uidaho.edu/sedimentation/objects/thumbs/sediment58_th.jpg
sediment59,https://cdm16748.contentdm.oclc.org/digital/api/singleitem/image/cpa/70010/default.jpg,sediment59.jpg,Chisled steps at Hole-in-The-Rock,"Chisled steps, Hole-In-The-Rock, Glen Canyon, Utah, 1921",,,"Kolb, Emery Clifford",NAU.PH.568.5245,129070,"Kolb, Emery"," Special Collections and Archives, Cline Library, Northern Arizona University.",1921,1921,sediment; Mormons; humans; tracks,Above Dam,Pre-Dam,,Glen Canyon; Hole-In-The-Rock,37.25576322,-110.8986693,https://cdm16748.contentdm.oclc.org/digital/collection/cpa/id/70010/rec/57,image/jpeg,Image;StillImage,eng,image,https://cdil.lib.uidaho.edu/sedimentation/objects/sediment59.jpg,https://cdil.lib.uidaho.edu/sedimentation/objects/small/sediment59_sm.jpg,https://cdil.lib.uidaho.edu/sedimentation/objects/thumbs/sediment59_th.jpg
sediment60,https://cdm16748.contentdm.oclc.org/digital/api/singleitem/image/cpa/10558/default.jpg,sediment60.jpg,Uranium mining at Lukachukais,Lukais [Lukachukais] - Newill. Uranium mining [ca. 1955] [Miner at work].,/atmosphere/#radium-dust,,"Nichols, Tad",NAU.PH.99.3.7.11.42,63752,"Nichols, Tad"," Special Collections and Archives, Cline Library, Northern Arizona University.",1954,1953-1955,sediment; uranium; mining; infrastructure; atmosphere,,,,Lukachukais,36.41622736,-109.2286617,https://cdm16748.contentdm.oclc.org/digital/collection/cpa/id/10558/rec/41,image/jpeg,Image;StillImage,eng,image,https://cdil.lib.uidaho.edu/sedimentation/objects/sediment60.jpg,https://cdil.lib.uidaho.edu/sedimentation/objects/small/sediment60_sm.jpg,https://cdil.lib.uidaho.edu/sedimentation/objects/thumbs/sediment60_th.jpg
sediment61,https://archive.library.nau.edu/digital/api/singleitem/image/cpa/12933/default.jpg,sediment61.jpg,Aerial view of the Mormon Trail,Mormon Trail (aerial view).,/atmosphere/#aridity,,"Nichols, Tad",NAU.PH.99.3.1.68.57,47141,"Nichols, Tad"," Special Collections and Archives, Cline Library, Northern Arizona University.",1957,1950-1965,sediment; land; aridity; atmosphere; water; river,,,,Glen Canyon; Mormon Trail,,,https://archive.library.nau.edu/digital/collection/cpa/id/12933/rec/99,image/jpeg,Image;StillImage,eng,image,https://cdil.lib.uidaho.edu/sedimentation/objects/sediment61.jpg,https://cdil.lib.uidaho.edu/sedimentation/objects/small/sediment61_sm.jpg,https://cdil.lib.uidaho.edu/sedimentation/objects/thumbs/sediment61_th.jpg
sediment62,https://cdm16748.contentdm.oclc.org/digital/api/singleitem/image/cpa/22204/default.jpg,sediment62.jpg,Abandoned mining equipment at Stanton Dredge,[Abandoned mining equipment at (Robert Brewster) Stanton Dredge; this photograph appears as a background image in Tad's Glen Canyon book on page 29.],,,"Nichols, Tad",NAU.PH.99.3.1.9.20,19749,"Nichols, Tad"," Special Collections and Archives, Cline Library, Northern Arizona University.",1956,1956,sediment; mining; infrastructure; humans,,Pre-Dam,,Glen Canyon; Stanton Dredge,37.56166554,-110.6313962,https://cdm16748.contentdm.oclc.org/digital/collection/cpa/id/22204/rec/26,image/jpeg,Image;StillImage,eng,image,https://cdil.lib.uidaho.edu/sedimentation/objects/sediment62.jpg,https://cdil.lib.uidaho.edu/sedimentation/objects/small/sediment62_sm.jpg,https://cdil.lib.uidaho.edu/sedimentation/objects/thumbs/sediment62_th.jpg
sediment63,https://cdm16748.contentdm.oclc.org/digital/api/singleitem/image/cpa/9422/default.jpg,sediment63.jpg,Ruins of mining cabin near Olympia Bar,Ruins of miner's cabin near Olympia Bar [constructed title] [This image appears in Tad's Glen Canyon book on page 25.].,,"Robert B. Stanton sought to build a railroad from Grand Junction to Gulf of California and staked out five placer claims in doing so, including near the mouth of Hanson (Pine Alcove) creek. He named his mining company the Hoskannini Mining Co., establisehd in 1897 in Glen Canyon, which became the largest gold mining outfit in Glen Canyon, and staked the entire canyon from Hite to Lee's Ferry. His 26 workmen used Hole in the Rock to carry their 8,000lbs of equipment, and picked steps into the slickrock over the wagon trail. Stanton became the second person to float from Green River through Glen Canyon while performing a railraod survey. By 1899, Stanton had 145 claims in glen Canyon, and bought a fleet of dredges in order to sift for gold dust in Glen Canyon's sand. He began dredge operations in 1901, but was stymied by variable water levels and his equipment's failure to capture gold dust. The silt-laden river water ate away at pump machinery and supply points were difficult due to the canyoned terrain. The project was abandoned. In 1909-1912, Charles H. Spencer and his American Placer Corp. prospected Lee's Ferry by sluicing, which was assisted by a pneumatic pipe which helped dredge sand and gravel for gold extraction, and processed the gold with almagamation, which involves mixing mecury to separate ore from gold. This process took place near the Paria River. The machinery was powered from coal, which was mined from Warren Creek, and transported at first by mule train, and then by steamboat, which did not last long as there was not enough coal to power the steam boat. Spencer ran into issues with the price of mercury, which was higher than the price of gold extraction, and his mine shut down. In the 1920s, oil pros","Nichols, Tad",NAU.PH.99.3.1.8.113,29762,"Nichols, Tad"," Special Collections and Archives, Cline Library, Northern Arizona University.",1955,1955,sediment; mining; infrastructure; dwellings; humans,Above Dam,Pre-Dam,submerged,Glen Canyon; Olympia Bar,37.59503187,-110.6007059,https://cdm16748.contentdm.oclc.org/digital/collection/cpa/id/9422/rec/360,image/jpeg,Image;StillImage,eng,image,https://cdil.lib.uidaho.edu/sedimentation/objects/sediment63.jpg,https://cdil.lib.uidaho.edu/sedimentation/objects/small/sediment63_sm.jpg,https://cdil.lib.uidaho.edu/sedimentation/objects/thumbs/sediment63_th.jpg
sediment64,https://cdm16748.contentdm.oclc.org/digital/collection/cpa/id/9422/rec/360,sediment64.jpg,Cliff dwelling near Schock Bar,[Frank Wright and Katie Lee beside cliff dwelling near Schock Bar.],,,"Nichols, Tad",NAU.PH.99.3.1.9.32,19792,"Nichols, Tad"," Special Collections and Archives, Cline Library, Northern Arizona University.",1956,1956,sediment; humans; exploration; dwellings,Above Dam,Pre-Dam,,Glen Canyon; Schock Bar,37.41024346,-110.7500747,https://cdm16748.contentdm.oclc.org/digital/collection/cpa/id/16911/rec/336,image/jpeg,Image;StillImage,eng,image,https://cdil.lib.uidaho.edu/sedimentation/objects/sediment64.jpg,https://cdil.lib.uidaho.edu/sedimentation/objects/small/sediment64_sm.jpg,https://cdil.lib.uidaho.edu/sedimentation/objects/thumbs/sediment64_th.jpg
sediment65,https://cdm16748.contentdm.oclc.org/digital/api/singleitem/image/cpa/16909/default.jpg,sediment65.jpg,Iceberg Canyon,[Iceberg Canyon - Mile 101.6.],,,"Nichols, Tad",NAU.PH.99.3.1.9.36,19801,"Nichols, Tad"," Special Collections and Archives, Cline Library, Northern Arizona University.",1956,1956,sediment; land; water,Above Dam,Pre-Dam,,Glen Canyon; Iceberg Canyon,37.33058912,-110.7659125,https://cdm16748.contentdm.oclc.org/digital/collection/cpa/id/16909/rec/331,image/jpeg,Image;StillImage,eng,image,https://cdil.lib.uidaho.edu/sedimentation/objects/sediment65.jpg,https://cdil.lib.uidaho.edu/sedimentation/objects/small/sediment65_sm.jpg,https://cdil.lib.uidaho.edu/sedimentation/objects/thumbs/sediment65_th.jpg
sediment66,https://cdm16748.contentdm.oclc.org/digital/api/singleitem/image/cpa/9383/default.jpg,sediment66.jpg,Shadows in Glen Canyon,[Canyon and shadows-Glen Canyon].,,,"Nichols, Tad",NAU.PH.99.3.1.11.133,20586,"Nichols, Tad"," Special Collections and Archives, Cline Library, Northern Arizona University.",1957,1957,sediment; land; water,,Pre-Dam,,Glen Canyon,,,https://cdm16748.contentdm.oclc.org/digital/collection/cpa/id/9383/rec/3210,image/jpeg,Image;StillImage,eng,image,https://cdil.lib.uidaho.edu/sedimentation/objects/sediment66.jpg,https://cdil.lib.uidaho.edu/sedimentation/objects/small/sediment66_sm.jpg,https://cdil.lib.uidaho.edu/sedimentation/objects/thumbs/sediment66_th.jpg
sediment67,https://cdm16748.contentdm.oclc.org/digital/api/singleitem/image/cpa/9572/default.jpg,sediment67.jpg,Tailings from miners at Olympia Bar,[Tailings from miners at Olympia Bar].,,,"Nichols, Tad",NAU.PH.99.3.1.11.75,20489,"Nichols, Tad"," Special Collections and Archives, Cline Library, Northern Arizona University.",1957,1957,sediment; mining; infrastructure; humans,Above Dam,Pre-Dam,,Glen Canyon; Olympia Bar,37.59503187,-110.6007059,https://cdm16748.contentdm.oclc.org/digital/collection/cpa/id/9572/rec/3221,image/jpeg,Image;StillImage,eng,image,https://cdil.lib.uidaho.edu/sedimentation/objects/sediment67.jpg,https://cdil.lib.uidaho.edu/sedimentation/objects/small/sediment67_sm.jpg,https://cdil.lib.uidaho.edu/sedimentation/objects/thumbs/sediment67_th.jpg
sediment68,https://cdm16748.contentdm.oclc.org/digital/api/singleitem/image/cpa/10343/default.jpg,sediment68.jpg,Rising lake waters nearly cover Gregory Bridge,Gregory Br. [Rising lake water nearly filling the open arch beneath Gregory Bridge].,,,"Nichols, Tad",NAU.PH.99.3.1.42.13,27450,"Nichols, Tad"," Special Collections and Archives, Cline Library, Northern Arizona University.",1968,1968,sediment; lake;,Above Dam,Post-Dam,submerged,Glen Canyon; Gregory Bridge,37.32967,-110.939052,https://cdm16748.contentdm.oclc.org/digital/collection/cpa/id/10343/rec/3232,image/jpeg,Image;StillImage,eng,image,https://cdil.lib.uidaho.edu/sedimentation/objects/sediment68.jpg,https://cdil.lib.uidaho.edu/sedimentation/objects/small/sediment68_sm.jpg,https://cdil.lib.uidaho.edu/sedimentation/objects/thumbs/sediment68_th.jpg
sediment69,https://cdm16748.contentdm.oclc.org/digital/api/singleitem/image/cpa/10722/default.jpg,sediment69.jpg,Navajo marbles on Wild Horse Bar,Navajo Marbles on Wild Horse Bar.,,,"Nichols, Tad",NAU.PH.99.3.1.18.86,23940,"Nichols, Tad"," Special Collections and Archives, Cline Library, Northern Arizona University.",1960,1960,sediment; land; ,Above Dam,Post-Dam,,Glen Canyon; Wild Horse Bar,37.09121905,-111.1464811,https://cdm16748.contentdm.oclc.org/digital/collection/cpa/id/10722/rec/3269,image/jpeg,Image;StillImage,eng,image,https://cdil.lib.uidaho.edu/sedimentation/objects/sediment69.jpg,https://cdil.lib.uidaho.edu/sedimentation/objects/small/sediment69_sm.jpg,https://cdil.lib.uidaho.edu/sedimentation/objects/thumbs/sediment69_th.jpg
sediment70,https://cdm16748.contentdm.oclc.org/digital/api/singleitem/image/cpa/22634/default.jpg,sediment70.jpg,Balanced rock,"Balanced Rocks, Mile 64.4 - One tenth mile below Balanced Rocks Bar up on the cap.",,"These are also called iron concretions, Navajo cherries, Navajo berries, Kayenta berries, Entrada berries, Moqui balls, or Shaman stones. They form in Navajo sandstone, when water with reducing agents (like acid or petroleum) moves through the permeable sandstone which dissolves the iron. The iron-water then flows and eventually the iron precipitates, cementing sand grains. They are made of concentric layers of iron and sand, and often times, microorganisms turn iron into iron oxide. The marbles are released as softer sandstone gets eroded away. Similar structures have been found on Mars, which scientists have lijnked to evidence of water and life. ","Nichols, Tad",NAU.PH.99.3.1.18.19,23775,"Nichols, Tad"," Special Collections and Archives, Cline Library, Northern Arizona University.",1960,1960,sediment; atmosphere; wind; wonder,Above Dam,Pre-Dam,,Glen Canyon; Balanced Rocks Bar,37.106279,-111.053393,https://cdm16748.contentdm.oclc.org/digital/collection/cpa/id/22634/rec/3347,image/jpeg,Image;StillImage,eng,image,https://cdil.lib.uidaho.edu/sedimentation/objects/sediment70.jpg,https://cdil.lib.uidaho.edu/sedimentation/objects/small/sediment70_sm.jpg,https://cdil.lib.uidaho.edu/sedimentation/objects/thumbs/sediment70_th.jpg
sediment71,https://cdm16748.contentdm.oclc.org/digital/api/singleitem/image/cpa/9769/default.jpg,sediment71.jpg,Animal petroglyph at Mystery Canyon,[Animal petroglyph at Mystery Canyon.],/atmosphere/#formations,,"Nichols, Tad",NAU.PH.99.3.1.7.135,18737,"Nichols, Tad"," Special Collections and Archives, Cline Library, Northern Arizona University.",1955,1955,sediment; humans; animals; petroglyphs; biota; art; tracks,Above Dam,Pre-Dam,,Glen Canyon; Mystery Canyon,37.14678115,-110.9419214,https://cdm16748.contentdm.oclc.org/digital/collection/cpa/id/9769/rec/3373,image/jpeg,Image;StillImage,eng,image,https://cdil.lib.uidaho.edu/sedimentation/objects/sediment71.jpg,https://cdil.lib.uidaho.edu/sedimentation/objects/small/sediment71_sm.jpg,https://cdil.lib.uidaho.edu/sedimentation/objects/thumbs/sediment71_th.jpg
sediment72,https://cdm16748.contentdm.oclc.org/digital/api/singleitem/image/cpa/10539/default.jpg,sediment72.jpg,Steps to Inscription House,Inscription House. Ruin. 1951. [Steps carved in rock],, ,"Nichols, Tad",NAU.PH.99.3.7.9.14,63629,"Nichols, Tad"," Special Collections and Archives, Cline Library, Northern Arizona University.",1951,1951,sediment; humans; tracks,Above Dam,Pre-Dam,,Glen Canyon; Inscription House,,,https://cdm16748.contentdm.oclc.org/digital/collection/cpa/id/10539/rec/3382,image/jpeg,Image;StillImage,eng,image,https://cdil.lib.uidaho.edu/sedimentation/objects/sediment72.jpg,https://cdil.lib.uidaho.edu/sedimentation/objects/small/sediment72_sm.jpg,https://cdil.lib.uidaho.edu/sedimentation/objects/thumbs/sediment72_th.jpg
