objectid,originalfilename,filename,title,originaltitle,tributary,description,creator,callnumber,itemnumber,collectionname,repository,date,archivaldate,subject,damspace,damtime,submerged,location,latitude,longitude,sourcelink,format,type,language,display_template,object_location,image_small,image_thumb
sediment105,https://cdm16748.contentdm.oclc.org/digital/api/singleitem/image/cpa/10601/default.jpg,sediment105.jpg,Glen Canyon Dam construction site,[Glen Canyon Dam construction site.],/atmosphere/#disruption,,"Nichols, Tad",NAU.PH.99.3.1.18.123,24049,"Nichols, Tad"," Special Collections and Archives, Cline Library, Northern Arizona University.",1960,1960,sediment; infrastructure; dam; humans,Dam,Dam,,Glen Canyon; Glen Canyon Dam,36.93783859,-111.4838413,https://cdm16748.contentdm.oclc.org/digital/collection/cpa/id/10601/rec/48,image/jpeg,Image;StillImage,eng,image,https://cdil.lib.uidaho.edu/sedimentation/objects/sediment105.jpg,https://cdil.lib.uidaho.edu/sedimentation/objects/small/sediment105_sm.jpg,https://cdil.lib.uidaho.edu/sedimentation/objects/thumbs/sediment105_th.jpg
sediment106,https://cdm16748.contentdm.oclc.org/digital/api/singleitem/image/cpa/10413/default.jpg,sediment106.jpg,Glen Canyon Dam construction site,[Glen Canyon Dam construction site.],,,"Nichols, Tad",NAU.PH.99.3.1.18.131,24130,"Nichols, Tad"," Special Collections and Archives, Cline Library, Northern Arizona University.",1960,1960,sediment; infrastructure; dam; humans,Dam,Dam,,Glen Canyon; Glen Canyon Dam,36.93783859,-111.4838413,https://cdm16748.contentdm.oclc.org/digital/collection/cpa/id/10413/rec/49,image/jpeg,Image;StillImage,eng,image,https://cdil.lib.uidaho.edu/sedimentation/objects/sediment106.jpg,https://cdil.lib.uidaho.edu/sedimentation/objects/small/sediment106_sm.jpg,https://cdil.lib.uidaho.edu/sedimentation/objects/thumbs/sediment106_th.jpg
sediment107,https://cdm16748.contentdm.oclc.org/digital/api/singleitem/image/cpa/10597/default.jpg,sediment107.jpg,Glen Canyon Dam construction site,[Glen Canyon Dam construction site.],,,"Nichols, Tad",NAU.PH.99.3.1.18.127,24053,"Nichols, Tad"," Special Collections and Archives, Cline Library, Northern Arizona University.",1960,1960,sediment; infrastructure; dam; humans,Dam,Dam,,Glen Canyon; Glen Canyon Dam,36.93783859,-111.4838413,https://cdm16748.contentdm.oclc.org/digital/collection/cpa/id/10597/rec/47,image/jpeg,Image;StillImage,eng,image,https://cdil.lib.uidaho.edu/sedimentation/objects/sediment107.jpg,https://cdil.lib.uidaho.edu/sedimentation/objects/small/sediment107_sm.jpg,https://cdil.lib.uidaho.edu/sedimentation/objects/thumbs/sediment107_th.jpg
sediment108,https://cdm16748.contentdm.oclc.org/digital/api/singleitem/image/cpa/10417/default.jpg,sediment108.jpg,Glen Canyon Dam construction site,[Glen Canyon Dam construction site.],,,"Nichols, Tad",NAU.PH.99.3.1.18.129,24128,"Nichols, Tad"," Special Collections and Archives, Cline Library, Northern Arizona University.",1960,1960,sediment; infrastructure; dam; humans,Dam,Dam,,Glen Canyon; Glen Canyon Dam,36.93783859,-111.4838413,https://cdm16748.contentdm.oclc.org/digital/collection/cpa/id/10417/rec/52,image/jpeg,Image;StillImage,eng,image,https://cdil.lib.uidaho.edu/sedimentation/objects/sediment108.jpg,https://cdil.lib.uidaho.edu/sedimentation/objects/small/sediment108_sm.jpg,https://cdil.lib.uidaho.edu/sedimentation/objects/thumbs/sediment108_th.jpg
sediment109,https://cdm16748.contentdm.oclc.org/digital/api/singleitem/image/cpa/10424/default.jpg,sediment109.jpg,Glen Canyon Dam construction site,[Glen Canyon Dam construction site.],,,"Nichols, Tad",NAU.PH.99.3.1.18.128,24108,"Nichols, Tad"," Special Collections and Archives, Cline Library, Northern Arizona University.",1960,1960,sediment; infrastructure; dam; humans,Dam,Dam,,Glen Canyon; Glen Canyon Dam,36.93783859,-111.4838413,https://cdm16748.contentdm.oclc.org/digital/collection/cpa/id/10424/rec/56,image/jpeg,Image;StillImage,eng,image,https://cdil.lib.uidaho.edu/sedimentation/objects/sediment109.jpg,https://cdil.lib.uidaho.edu/sedimentation/objects/small/sediment109_sm.jpg,https://cdil.lib.uidaho.edu/sedimentation/objects/thumbs/sediment109_th.jpg
sediment110,https://cdm16748.contentdm.oclc.org/digital/api/singleitem/image/cpa/11211/default.jpg,sediment110.jpg,Glen Canyon Dam construction site,[Construction site at Glen Canyon Dam and bridge.],,,"Nichols, Tad",NAU.PH.99.3.1.18.161,14253,"Nichols, Tad"," Special Collections and Archives, Cline Library, Northern Arizona University.",1960,1960,sediment; infrastructure; dam; humans,Dam,Dam,,Glen Canyon; Glen Canyon Dam,36.93783859,-111.4838413,https://cdm16748.contentdm.oclc.org/digital/collection/cpa/id/11211/rec/58,image/jpeg,Image;StillImage,eng,image,https://cdil.lib.uidaho.edu/sedimentation/objects/sediment110.jpg,https://cdil.lib.uidaho.edu/sedimentation/objects/small/sediment110_sm.jpg,https://cdil.lib.uidaho.edu/sedimentation/objects/thumbs/sediment110_th.jpg
sediment111,https://cdm16748.contentdm.oclc.org/digital/api/singleitem/image/cpa/16699/default.jpg,sediment111.jpg,Inscriptions at Shock Bar,"[Inscriptions at Schock Bar - W. Black 1927, among others.]",,,"Nichols, Tad",NAU.PH.99.3.1.9.30,21057,"Nichols, Tad"," Special Collections and Archives, Cline Library, Northern Arizona University.",1956,1956,sediment; humans; exploration; tracks,Above Dam,Pre-Dam,,Glen Canyon; Schock Bar,37.41024346,-110.7500747,https://cdm16748.contentdm.oclc.org/digital/collection/cpa/id/16699/rec/3778,image/jpeg,Image;StillImage,eng,image,https://cdil.lib.uidaho.edu/sedimentation/objects/sediment111.jpg,https://cdil.lib.uidaho.edu/sedimentation/objects/small/sediment111_sm.jpg,https://cdil.lib.uidaho.edu/sedimentation/objects/thumbs/sediment111_th.jpg
sediment112,https://cdm16748.contentdm.oclc.org/digital/api/singleitem/image/cpa/10714/default.jpg,sediment112.jpg,Entrance to Cathedral Canyon,[People and boat at entrance to Cathedral Canyon.],,,"Nichols, Tad",NAU.PH.99.3.1.17.66,23423,"Nichols, Tad"," Special Collections and Archives, Cline Library, Northern Arizona University.",1959,1959-1960,sediment; land; water; river; exploration,Above Dam,Pre-Dam,,Glen Canyon; Cathedral Canyon,37.10853238,-111.0207651,https://cdm16748.contentdm.oclc.org/digital/collection/cpa/id/10714/rec/3060,image/jpeg,Image;StillImage,eng,image,https://cdil.lib.uidaho.edu/sedimentation/objects/sediment112.jpg,https://cdil.lib.uidaho.edu/sedimentation/objects/small/sediment112_sm.jpg,https://cdil.lib.uidaho.edu/sedimentation/objects/thumbs/sediment112_th.jpg
sediment113,https://cdm16748.contentdm.oclc.org/digital/api/singleitem/image/cpa/11681/default.jpg,sediment113.jpg,Mud cracks,[Mud cracks.],,,"Nichols, Tad",NAU.PH.99.3.1.60.17,26325,"Nichols, Tad"," Special Collections and Archives, Cline Library, Northern Arizona University.",1973,1973,sediment; land; water,,Post-Dam,,,,,https://cdm16748.contentdm.oclc.org/digital/collection/cpa/id/11681/rec/3090,image/jpeg,Image;StillImage,eng,image,https://cdil.lib.uidaho.edu/sedimentation/objects/sediment113.jpg,https://cdil.lib.uidaho.edu/sedimentation/objects/small/sediment113_sm.jpg,https://cdil.lib.uidaho.edu/sedimentation/objects/thumbs/sediment113_th.jpg
sediment114,https://cdm16748.contentdm.oclc.org/digital/api/singleitem/image/cpa/13987/default.jpg,sediment114.jpg,Aerial view of upper Glen Canyon,Upper Glen - Air views - 17-Sept-63.,/atmosphere/#aridity,,"Nichols, Tad",NAU.PH.99.3.1.31.54,29308,"Nichols, Tad"," Special Collections and Archives, Cline Library, Northern Arizona University.",1963,1963,sediment; land; river,Above Dam,Pre-Dam,,Glen Canyon,,,https://cdm16748.contentdm.oclc.org/digital/collection/cpa/id/13987/rec/3191,image/jpeg,Image;StillImage,eng,image,https://cdil.lib.uidaho.edu/sedimentation/objects/sediment114.jpg,https://cdil.lib.uidaho.edu/sedimentation/objects/small/sediment114_sm.jpg,https://cdil.lib.uidaho.edu/sedimentation/objects/thumbs/sediment114_th.jpg
sediment115,https://cdm16748.contentdm.oclc.org/digital/api/singleitem/image/cpa/22223/default.jpg,sediment115.jpg,Looking down on a pool in Iceberg Canyon,"[Iceberg Canyon, Mile 101.6 - Katie looking down at pool, reflections in water; this image appears in Tad's Glen Canyon book on page 47.]",,,"Nichols, Tad",NAU.PH.99.3.1.9.39,19804,"Nichols, Tad"," Special Collections and Archives, Cline Library, Northern Arizona University.",1956,1956,sediment; land,Above Dam,Pre-Dam,,Glen Canyon; Iceberg Canyon,37.33058912,-110.7659125,https://cdm16748.contentdm.oclc.org/digital/collection/cpa/id/22223/rec/2835,image/jpeg,Image;StillImage,eng,image,https://cdil.lib.uidaho.edu/sedimentation/objects/sediment115.jpg,https://cdil.lib.uidaho.edu/sedimentation/objects/small/sediment115_sm.jpg,https://cdil.lib.uidaho.edu/sedimentation/objects/thumbs/sediment115_th.jpg
sediment116,https://cdm16748.contentdm.oclc.org/digital/api/singleitem/image/cpa/11205/default.jpg,sediment116.jpg,Granary at Stanton Canyon,[Granary at Stanton Canyon; this image appears in Tad's Glen Canyon book on page 43.],,,"Nichols, Tad",NAU.PH.99.3.1.18.9,23757,"Nichols, Tad"," Special Collections and Archives, Cline Library, Northern Arizona University.",1960,1960,sediment; humans; dwellings,Above Dam,Pre-Dam,,Glen Canyon; Stanton Canyon,37.50586819,-110.6991582,https://cdm16748.contentdm.oclc.org/digital/collection/cpa/id/11205/rec/2,image/jpeg,Image;StillImage,eng,image,https://cdil.lib.uidaho.edu/sedimentation/objects/sediment116.jpg,https://cdil.lib.uidaho.edu/sedimentation/objects/small/sediment116_sm.jpg,https://cdil.lib.uidaho.edu/sedimentation/objects/thumbs/sediment116_th.jpg
sediment117,https://cdm16748.contentdm.oclc.org/digital/api/singleitem/image/cpa/17315/default.jpg,sediment117.jpg,Pottery found in West Canyon,[Prehistoric pot found in West Canyon; this image appears in Tad's Glen Canyon book on page 128.],,,"Nichols, Tad",NAU.PH.99.3.1.15.99,28485,"Nichols, Tad"," Special Collections and Archives, Cline Library, Northern Arizona University.",1958,1958,sediment; humans; pottery; art,Above Dam,Pre-Dam,,Glen Canyon; West Canyon,37.03020724,-111.1943375,https://cdm16748.contentdm.oclc.org/digital/collection/cpa/id/17315/rec/34,image/jpeg,Image;StillImage,eng,image,https://cdil.lib.uidaho.edu/sedimentation/objects/sediment117.jpg,https://cdil.lib.uidaho.edu/sedimentation/objects/small/sediment117_sm.jpg,https://cdil.lib.uidaho.edu/sedimentation/objects/thumbs/sediment117_th.jpg
sediment118,https://cdm16748.contentdm.oclc.org/digital/api/singleitem/image/cpa/9453/default.jpg,sediment118.jpg,Ferns in entrance to Balanced Rocks Canyon,[Ferns in entrance to Balanced Rocks Canyon] [This image appears in Tad's Glen Canyon book on page 110.].,,,"Nichols, Tad",NAU.PH.99.3.1.11.86,20511,"Nichols, Tad"," Special Collections and Archives, Cline Library, Northern Arizona University.",1957,1957,sediment; vegetation; water; river; biota,Above Dam,Pre-Dam,,Glen Canyon; Balanced Rocks Canyon,37.1287222,-111.0452434,https://cdm16748.contentdm.oclc.org/digital/collection/cpa/id/9453/rec/47,image/jpeg,Image;StillImage,eng,image,https://cdil.lib.uidaho.edu/sedimentation/objects/sediment118.jpg,https://cdil.lib.uidaho.edu/sedimentation/objects/small/sediment118_sm.jpg,https://cdil.lib.uidaho.edu/sedimentation/objects/thumbs/sediment118_th.jpg
sediment119,https://cdm16748.contentdm.oclc.org/digital/api/singleitem/image/cpa/10037/default.jpg,sediment119.jpg,Petroglyph of hunter with bow and arrow,[Petroglyph: hunter with bow and arrow-Smith Fork] [This image appears in Tad's Glen Canyon book on page 26.].,/humans/#inscriptions,,"Nichols, Tad",NAU.PH.99.3.1.11.45,20380,"Nichols, Tad"," Special Collections and Archives, Cline Library, Northern Arizona University.",1957,1957,sediment; humans; petroglyphs; art;,Above Dam,Pre-Dam,,Glen Canyon; Smith Fork,37.59933999,-110.6395824,https://cdm16748.contentdm.oclc.org/digital/collection/cpa/id/10037/rec/56,image/jpeg,Image;StillImage,eng,image,https://cdil.lib.uidaho.edu/sedimentation/objects/sediment119.jpg,https://cdil.lib.uidaho.edu/sedimentation/objects/small/sediment119_sm.jpg,https://cdil.lib.uidaho.edu/sedimentation/objects/thumbs/sediment119_th.jpg
sediment120,https://cdm16748.contentdm.oclc.org/digital/api/singleitem/image/cpa/9507/default.jpg,sediment120.jpg,Ferns in Grotto Canyon,[Ferns in Grotto Canyon] [This image appears in Tad's Glen Canyon book on page 116.].,,,"Nichols, Tad",NAU.PH.99.3.1.11.85,20510,"Nichols, Tad"," Special Collections and Archives, Cline Library, Northern Arizona University.",1957,1957,sediment; water; vegetation; biota,Above Dam,Pre-Dam,,Glen Canyon; Grotto Canyon,37.08393474,-111.1364887,https://cdm16748.contentdm.oclc.org/digital/collection/cpa/id/9507/rec/93,image/jpeg,Image;StillImage,eng,image,https://cdil.lib.uidaho.edu/sedimentation/objects/sediment120.jpg,https://cdil.lib.uidaho.edu/sedimentation/objects/small/sediment120_sm.jpg,https://cdil.lib.uidaho.edu/sedimentation/objects/thumbs/sediment120_th.jpg
sediment121,https://cdm16748.contentdm.oclc.org/digital/api/singleitem/image/cpa/21693/default.jpg,sediment121.jpg,Cliff face in Glen Canyon,[River and cliff-face in Glen Canyon],,,"Nichols, Tad",NAU.PH.99.3.1.27.87,17745,"Nichols, Tad"," Special Collections and Archives, Cline Library, Northern Arizona University.",1962,1962,sediment; land,Above Dam,Dam,,Glen Canyon,,,https://cdm16748.contentdm.oclc.org/digital/collection/cpa/id/21693/rec/3725,image/jpeg,Image;StillImage,eng,image,https://cdil.lib.uidaho.edu/sedimentation/objects/sediment121.jpg,https://cdil.lib.uidaho.edu/sedimentation/objects/small/sediment121_sm.jpg,https://cdil.lib.uidaho.edu/sedimentation/objects/thumbs/sediment121_th.jpg
sediment122,https://cdm16748.contentdm.oclc.org/digital/api/singleitem/image/cpa/11512/default.jpg,sediment122.jpg,Iceberg Canyon,[Iceberg Canyon; this image appears in Tad's Glen Canyon book on page 46.],,,"Nichols, Tad",NAU.PH.99.3.1.71.63,27067,"Nichols, Tad"," Special Collections and Archives, Cline Library, Northern Arizona University.",1957,1950-1965,sediment; land; water,Above Dam,Dam ,,Glen Canyon; Iceberg Canyon,37.33058912,-110.7659125,https://cdm16748.contentdm.oclc.org/digital/collection/cpa/id/11512/rec/3690,image/jpeg,Image;StillImage,eng,image,https://cdil.lib.uidaho.edu/sedimentation/objects/sediment122.jpg,https://cdil.lib.uidaho.edu/sedimentation/objects/small/sediment122_sm.jpg,https://cdil.lib.uidaho.edu/sedimentation/objects/thumbs/sediment122_th.jpg
sediment123,https://cdm16748.contentdm.oclc.org/digital/api/singleitem/image/ahsnd/577/default.jpg,sediment123.jpg,"Glen Canyon damsite aerial view, ca. 1959","Glen Canyon damsite aerial view, ca. 1959",/atmosphere/#aridity; /humans/#subsumation,,United States. Bureau of Reclamation,AHS.0711.00011,9861,"Roat, Evelyn"," Special Collections and Archives, Cline Library, Northern Arizona University.",1959,1959,sediment; infrastructure; dam; humans,Dam,Dam,,Glen Canyon; Glen Canyon Dam,36.93783859,-111.4838413,https://cdm16748.contentdm.oclc.org/digital/collection/ahsnd/id/577/rec/94,image/jpeg,Image;StillImage,eng,image,https://cdil.lib.uidaho.edu/sedimentation/objects/sediment123.jpg,https://cdil.lib.uidaho.edu/sedimentation/objects/small/sediment123_sm.jpg,https://cdil.lib.uidaho.edu/sedimentation/objects/thumbs/sediment123_th.jpg
sediment124,https://cdm16748.contentdm.oclc.org/digital/api/singleitem/image/cpa/10095/default.jpg,sediment124.jpg,Lantern and sewing machine in California Bar caves,Lantern and pedal sewing machine left behind by miners - Found inside one of the the California Bar caves. 'We Three' Trip - September/October 1955.[constructed title] [This image appears in Tad's Glen Canyon book on page 29.],,,"Nichols, Tad",NAU.PH.99.3.1.8.33,29569,"Nichols, Tad"," Special Collections and Archives, Cline Library, Northern Arizona University.",1955,1955,sediment; infrastructure; mining; dwellings; humans,Above Dam,Pre-Dam,,Glen Canyon; California Bar,,,https://cdm16748.contentdm.oclc.org/digital/collection/cpa/id/10095/rec/102,image/jpeg,Image;StillImage,eng,image,https://cdil.lib.uidaho.edu/sedimentation/objects/sediment124.jpg,https://cdil.lib.uidaho.edu/sedimentation/objects/small/sediment124_sm.jpg,https://cdil.lib.uidaho.edu/sedimentation/objects/thumbs/sediment124_th.jpg
sediment125,https://cdm16748.contentdm.oclc.org/digital/api/singleitem/image/cpa/20426/default.jpg,sediment125.jpg,California bar caves,California Bar caves. 'We Three' Trip - September/October 1955. [constructed title],,"Placer miners set up shop on this flat sandy bar as they scraped out the canyon walls, looking for gold. The miners built houses out of rock, and even a grave for A.G. Turner, a miner who died on the bar. The bar was claimed by Hawthorn, Brown, Keeler, and Haskell, but passed into other hands, including the Chaffins. R.B. Stanton claimed in 1899 that $30,000 of gold were extracted from California Bar. ","Nichols, Tad",NAU.PH.99.3.1.8.29,29032,"Nichols, Tad"," Special Collections and Archives, Cline Library, Northern Arizona University.",1955,1955,sediment; mining; dwellings,Above Dam,Pre-Dam,,Glen Canyon; California Bar,,,https://cdm16748.contentdm.oclc.org/digital/collection/cpa/id/20426/rec/9,image/jpeg,Image;StillImage,eng,image,https://cdil.lib.uidaho.edu/sedimentation/objects/sediment125.jpg,https://cdil.lib.uidaho.edu/sedimentation/objects/small/sediment125_sm.jpg,https://cdil.lib.uidaho.edu/sedimentation/objects/thumbs/sediment125_th.jpg
sediment126,https://cdm16748.contentdm.oclc.org/digital/api/singleitem/image/cpa/10078/default.jpg,sediment126.jpg,Stone ruins at California Bar,[Stone walls - Ruins and old wood stove at California Bar].,,,"Nichols, Tad",NAU.PH.99.3.1.33.13,28844,"Nichols, Tad"," Special Collections and Archives, Cline Library, Northern Arizona University.",1964,1964,sediment; mining; dwellings,Above Dam,Pre-Dam,,Glen Canyon; California Bar,,,https://cdm16748.contentdm.oclc.org/digital/collection/cpa/id/10078/rec/10,image/jpeg,Image;StillImage,eng,image,https://cdil.lib.uidaho.edu/sedimentation/objects/sediment126.jpg,https://cdil.lib.uidaho.edu/sedimentation/objects/small/sediment126_sm.jpg,https://cdil.lib.uidaho.edu/sedimentation/objects/thumbs/sediment126_th.jpg
sediment127,https://cdm16748.contentdm.oclc.org/digital/api/singleitem/image/cpa/4279/default.jpg,sediment127.jpg,Yucca blossoms in front of cliff wall,[Yucca blossoms in silhouette against cliff wall.],/atmosphere/#reemergence,,"Nichols, Tad",NAU.PH.99.3.1.18.100,23965,"Nichols, Tad"," Special Collections and Archives, Cline Library, Northern Arizona University.",1960,1960,sediment; vegetation; biota; yucca,,,,Glen Canyon,,,https://cdm16748.contentdm.oclc.org/digital/collection/cpa/id/4279/rec/239,image/jpeg,Image;StillImage,eng,image,https://cdil.lib.uidaho.edu/sedimentation/objects/sediment127.jpg,https://cdil.lib.uidaho.edu/sedimentation/objects/small/sediment127_sm.jpg,https://cdil.lib.uidaho.edu/sedimentation/objects/thumbs/sediment127_th.jpg
sediment128,https://cdm16748.contentdm.oclc.org/digital/api/singleitem/image/cpa/21611/default.jpg,sediment128.jpg,Yucca blossoms in front of cliff wall,[Yucca blossoms against cliff wall.],,,"Nichols, Tad",NAU.PH.99.3.1.18.109,23995,"Nichols, Tad"," Special Collections and Archives, Cline Library, Northern Arizona University.",1960,1960,sediment; vegetation; yucca; biota,,,,Glen Canyon,,,https://cdm16748.contentdm.oclc.org/digital/collection/cpa/id/21611/rec/315,image/jpeg,Image;StillImage,eng,image,https://cdil.lib.uidaho.edu/sedimentation/objects/sediment128.jpg,https://cdil.lib.uidaho.edu/sedimentation/objects/small/sediment128_sm.jpg,https://cdil.lib.uidaho.edu/sedimentation/objects/thumbs/sediment128_th.jpg
sediment129,https://cdm16748.contentdm.oclc.org/digital/api/singleitem/image/cpa/9723/default.jpg,sediment129.jpg,Boat among swirled rock,[Boat in arm of lake among swirled rock formations - Cross-bedding in sedimentary rock].,/atmosphere/#wind-memories,,"Nichols, Tad",NAU.PH.99.3.1.33.43,28858,"Nichols, Tad"," Special Collections and Archives, Cline Library, Northern Arizona University.",1964,1964,sediment; atmosphere; wind; tourism ,Above Dam,Dam,,Glen Canyon,,,https://cdm16748.contentdm.oclc.org/digital/collection/cpa/id/9723/rec/351,image/jpeg,Image;StillImage,eng,image,https://cdil.lib.uidaho.edu/sedimentation/objects/sediment129.jpg,https://cdil.lib.uidaho.edu/sedimentation/objects/small/sediment129_sm.jpg,https://cdil.lib.uidaho.edu/sedimentation/objects/thumbs/sediment129_th.jpg
sediment130,https://cdm16748.contentdm.oclc.org/digital/api/singleitem/image/cpa/10090/default.jpg,sediment130.jpg,Alonzo Tuner's tombstone at California Bar,"[Tombstone at old gold-mining camp on California Bar: In memory of A.G. Tuner - Died April 26, 1923. Age 69. This image appears in Tad's Glen Canyon book on page 28.].",,,"Nichols, Tad",NAU.PH.99.3.1.33.17,28845,"Nichols, Tad"," Special Collections and Archives, Cline Library, Northern Arizona University.",1964,1964,sediment; humans; mining,Above Dam,Dam,,Glen Canyon; California Bar,,,https://cdm16748.contentdm.oclc.org/digital/collection/cpa/id/10090/rec/3,image/jpeg,Image;StillImage,eng,image,https://cdil.lib.uidaho.edu/sedimentation/objects/sediment130.jpg,https://cdil.lib.uidaho.edu/sedimentation/objects/small/sediment130_sm.jpg,https://cdil.lib.uidaho.edu/sedimentation/objects/thumbs/sediment130_th.jpg
sediment131,https://cdm16748.contentdm.oclc.org/digital/api/singleitem/image/cpa/9324/default.jpg,sediment131.jpg,Markings in the sand,[Markings in the sand. A cropped version of this photograph appears as a background image in Tad's book- Glen Canyon Images of a Lost World- on page 79.],/atmosphere/#formations,,"Nichols, Tad",NAU.PH.99.3.1.27.110,18261,"Nichols, Tad"," Special Collections and Archives, Cline Library, Northern Arizona University.",1962,1962,sediment; land; water; tracks,Above Dam,Dam,,Glen Canyon,,,https://cdm16748.contentdm.oclc.org/digital/collection/cpa/id/9324/rec/98,image/jpeg,Image;StillImage,eng,image,https://cdil.lib.uidaho.edu/sedimentation/objects/sediment131.jpg,https://cdil.lib.uidaho.edu/sedimentation/objects/small/sediment131_sm.jpg,https://cdil.lib.uidaho.edu/sedimentation/objects/thumbs/sediment131_th.jpg
sediment132,https://cdm16748.contentdm.oclc.org/digital/api/singleitem/image/cpa/9717/default.jpg,sediment132.jpg,Crossbedding in sedimentary rock,[Cross-bedding in sedimentary rock. This image appears in Tad's Glen Canyon book on page 57.].,,,"Nichols, Tad",NAU.PH.99.3.1.33.52,28863,"Nichols, Tad"," Special Collections and Archives, Cline Library, Northern Arizona University.",1964,1964,sediment; atmosphere; wind; tracks,Above Dam,Dam,,Glen Canyon,,,https://cdm16748.contentdm.oclc.org/digital/collection/cpa/id/9717/rec/5,image/jpeg,Image;StillImage,eng,image,https://cdil.lib.uidaho.edu/sedimentation/objects/sediment132.jpg,https://cdil.lib.uidaho.edu/sedimentation/objects/small/sediment132_sm.jpg,https://cdil.lib.uidaho.edu/sedimentation/objects/thumbs/sediment132_th.jpg
sediment133,https://cdm16748.contentdm.oclc.org/digital/api/singleitem/image/cpa/9724/default.jpg,sediment133.jpg,Crossbedding in sedimentary rock,[Cross-bedding in sedimentary rock. This photograph appears as a background image in Tad's Glen Canyon book on page 56.].,/atmosphere/#wind-memories; /atmosphere/#crossed-tracks,,"Nichols, Tad",NAU.PH.99.3.1.33.45,28859,"Nichols, Tad"," Special Collections and Archives, Cline Library, Northern Arizona University.",1964,1964,sediment; atmosphere; wind; tracks,Above Dam,Dam,,Glen Canyon,,,https://cdm16748.contentdm.oclc.org/digital/collection/cpa/id/9724/rec/7,image/jpeg,Image;StillImage,eng,image,https://cdil.lib.uidaho.edu/sedimentation/objects/sediment133.jpg,https://cdil.lib.uidaho.edu/sedimentation/objects/small/sediment133_sm.jpg,https://cdil.lib.uidaho.edu/sedimentation/objects/thumbs/sediment133_th.jpg
sediment134,https://cdm16748.contentdm.oclc.org/digital/api/singleitem/image/cpa/21212/default.jpg,sediment134.jpg,Eroding sand dune at Escalante River,[Eroding sand dune at Escalante River; this image appears in Tad's Glen Canyon book on page 56.],,,"Nichols, Tad",NAU.PH.99.3.1.69.3,27743,"Nichols, Tad"," Special Collections and Archives, Cline Library, Northern Arizona University.",1960,1955-1965,sediment; land,Above Dam,Pre-Dam,,Glen Canyon; Escalante River,37.38602994,-110.9159012,https://cdm16748.contentdm.oclc.org/digital/collection/cpa/id/21212/rec/87,image/jpeg,Image;StillImage,eng,image,https://cdil.lib.uidaho.edu/sedimentation/objects/sediment134.jpg,https://cdil.lib.uidaho.edu/sedimentation/objects/small/sediment134_sm.jpg,https://cdil.lib.uidaho.edu/sedimentation/objects/thumbs/sediment134_th.jpg
sediment135,https://cdm16748.contentdm.oclc.org/digital/api/singleitem/image/cpa/9504/default.jpg,sediment135.jpg,Moki steps at Mystery Canyon,[Frank Wright on Moki steps at Mystery Canyon. This image appears in Tad's book- Glen Canyon Images of a Lost World on page 80.],/humans/#palimpsests,,"Nichols, Tad",NAU.PH.99.3.1.27.30,17451,"Nichols, Tad"," Special Collections and Archives, Cline Library, Northern Arizona University.",1962,1962,sediment; exploration; humans; tracks; humans,Above Dam,Dam,,Glen Canyon; Mystery Canyon,37.14678115,-110.9419214,https://cdm16748.contentdm.oclc.org/digital/collection/cpa/id/9504/rec/91,image/jpeg,Image;StillImage,eng,image,https://cdil.lib.uidaho.edu/sedimentation/objects/sediment135.jpg,https://cdil.lib.uidaho.edu/sedimentation/objects/small/sediment135_sm.jpg,https://cdil.lib.uidaho.edu/sedimentation/objects/thumbs/sediment135_th.jpg
